{
  "$schema": "https://json-schema.org/draft/2020-12/schema",
  "$id": "urn:research-loom:profiles:profile-manifest:0.1.0",
  "title": "research-loom canonical profile manifest",
  "description": "Implementation-neutral manifest for declarative Research, Organization, Narrative, and Publication profiles.",
  "type": "object",
  "additionalProperties": false,
  "required": [
    "schema_version",
    "profile_id",
    "profile_type",
    "profile_version",
    "core_compatibility"
  ],
  "properties": {
    "schema_version": {
      "const": "0.1.0"
    },
    "profile_id": {
      "$ref": "#/$defs/profile_id"
    },
    "profile_type": {
      "$ref": "#/$defs/profile_type"
    },
    "profile_version": {
      "$ref": "#/$defs/semver"
    },
    "description": {
      "type": "string"
    },
    "core_compatibility": {
      "$ref": "#/$defs/core_compatibility"
    },
    "extends": {
      "type": "array",
      "items": {
        "$ref": "#/$defs/profile_requirement"
      },
      "uniqueItems": true,
      "default": []
    },
    "requires": {
      "type": "array",
      "items": {
        "$ref": "#/$defs/profile_requirement"
      },
      "uniqueItems": true,
      "default": []
    },
    "constraints": {
      "type": "array",
      "items": {
        "$ref": "#/$defs/constraint_declaration"
      },
      "default": []
    },
    "core_invariant_strengthenings": {
      "type": "array",
      "items": {
        "$ref": "#/$defs/invariant_strengthening"
      },
      "default": []
    },
    "resources": {
      "type": "array",
      "items": {
        "$ref": "#/$defs/resource"
      },
      "default": []
    }
  },
  "allOf": [
    {
      "if": {
        "properties": {
          "profile_type": {
            "const": "research"
          }
        },
        "required": [
          "profile_type"
        ]
      },
      "then": {
        "properties": {
          "extends": {
            "items": {
              "$ref": "#/$defs/research_requirement"
            }
          }
        }
      }
    },
    {
      "if": {
        "properties": {
          "profile_type": {
            "const": "organization"
          }
        },
        "required": [
          "profile_type"
        ]
      },
      "then": {
        "properties": {
          "extends": {
            "items": {
              "$ref": "#/$defs/organization_requirement"
            }
          }
        }
      }
    },
    {
      "if": {
        "properties": {
          "profile_type": {
            "const": "narrative"
          }
        },
        "required": [
          "profile_type"
        ]
      },
      "then": {
        "properties": {
          "extends": {
            "items": {
              "$ref": "#/$defs/narrative_requirement"
            }
          }
        }
      }
    },
    {
      "if": {
        "properties": {
          "profile_type": {
            "const": "publication"
          }
        },
        "required": [
          "profile_type"
        ]
      },
      "then": {
        "properties": {
          "extends": {
            "items": {
              "$ref": "#/$defs/publication_requirement"
            }
          }
        }
      }
    }
  ],
  "$defs": {
    "profile_id": {
      "type": "string",
      "pattern": "^[a-z0-9][a-z0-9._-]{0,127}$"
    },
    "profile_type": {
      "enum": [
        "research",
        "organization",
        "narrative",
        "publication"
      ]
    },
    "semver": {
      "type": "string",
      "pattern": "^(0|[1-9][0-9]*)\\.(0|[1-9][0-9]*)\\.(0|[1-9][0-9]*)$"
    },
    "version_range": {
      "type": "string",
      "description": "Exact SemVer or a whitespace-separated conjunction of simple SemVer comparators.",
      "pattern": "^(?:(?:0|[1-9][0-9]*)\\.(?:0|[1-9][0-9]*)\\.(?:0|[1-9][0-9]*)|(?:(?:>=|>|<=|<|=)(?:0|[1-9][0-9]*)\\.(?:0|[1-9][0-9]*)\\.(?:0|[1-9][0-9]*))(?:\\s+(?:(?:>=|>|<=|<|=)(?:0|[1-9][0-9]*)\\.(?:0|[1-9][0-9]*)\\.(?:0|[1-9][0-9]*)))*)$"
    },
    "core_compatibility": {
      "type": "object",
      "additionalProperties": false,
      "required": [
        "research_contract",
        "invariant_contract"
      ],
      "properties": {
        "research_contract": {
          "$ref": "#/$defs/version_range"
        },
        "invariant_contract": {
          "$ref": "#/$defs/version_range"
        }
      }
    },
    "profile_requirement": {
      "type": "object",
      "additionalProperties": false,
      "required": [
        "profile_id",
        "profile_type",
        "version"
      ],
      "properties": {
        "profile_id": {
          "$ref": "#/$defs/profile_id"
        },
        "profile_type": {
          "$ref": "#/$defs/profile_type"
        },
        "version": {
          "$ref": "#/$defs/version_range"
        }
      }
    },
    "research_requirement": {
      "allOf": [
        {
          "$ref": "#/$defs/profile_requirement"
        },
        {
          "properties": {
            "profile_type": {
              "const": "research"
            }
          }
        }
      ]
    },
    "organization_requirement": {
      "allOf": [
        {
          "$ref": "#/$defs/profile_requirement"
        },
        {
          "properties": {
            "profile_type": {
              "const": "organization"
            }
          }
        }
      ]
    },
    "narrative_requirement": {
      "allOf": [
        {
          "$ref": "#/$defs/profile_requirement"
        },
        {
          "properties": {
            "profile_type": {
              "const": "narrative"
            }
          }
        }
      ]
    },
    "publication_requirement": {
      "allOf": [
        {
          "$ref": "#/$defs/profile_requirement"
        },
        {
          "properties": {
            "profile_type": {
              "const": "publication"
            }
          }
        }
      ]
    },
    "constraint_declaration": {
      "type": "object",
      "additionalProperties": false,
      "required": [
        "id",
        "path",
        "merge_strategy",
        "value"
      ],
      "properties": {
        "id": {
          "type": "string",
          "pattern": "^[A-Za-z0-9][A-Za-z0-9._-]{0,127}$"
        },
        "path": {
          "type": "string",
          "description": "Stable semantic constraint path; core.* is reserved to Core.",
          "pattern": "^(?!core\\.)(?:[a-z][a-z0-9_]*)(?:\\.[a-z][a-z0-9_]*)+$"
        },
        "merge_strategy": {
          "enum": [
            "must_equal",
            "union",
            "intersection",
            "max",
            "min",
            "replace"
          ]
        },
        "value": {},
        "rationale": {
          "type": "string"
        }
      },
      "allOf": [
        {
          "if": {
            "properties": {
              "merge_strategy": {
                "enum": [
                  "union",
                  "intersection"
                ]
              }
            },
            "required": [
              "merge_strategy"
            ]
          },
          "then": {
            "properties": {
              "value": {
                "type": "array",
                "uniqueItems": true
              }
            }
          }
        },
        {
          "if": {
            "properties": {
              "merge_strategy": {
                "enum": [
                  "max",
                  "min"
                ]
              }
            },
            "required": [
              "merge_strategy"
            ]
          },
          "then": {
            "properties": {
              "value": {
                "type": "number"
              }
            }
          }
        }
      ]
    },
    "validator_binding": {
      "type": "object",
      "additionalProperties": false,
      "required": [
        "validator_id",
        "validator_version",
        "form_id"
      ],
      "properties": {
        "validator_id": {
          "type": "string",
          "pattern": "^[a-z][a-z0-9.-]{2,127}$"
        },
        "validator_version": {
          "$ref": "#/$defs/semver"
        },
        "form_id": {
          "type": "string",
          "pattern": "^[a-z0-9][a-z0-9._-]{0,127}$"
        }
      }
    },
    "invariant_strengthening": {
      "type": "object",
      "additionalProperties": false,
      "required": [
        "invariant_id",
        "effect",
        "constraint_ids",
        "validator_binding",
        "rationale"
      ],
      "properties": {
        "invariant_id": {
          "type": "string",
          "pattern": "^CORE-[A-Z]+-[0-9]{3}$"
        },
        "effect": {
          "const": "strengthen"
        },
        "constraint_ids": {
          "type": "array",
          "minItems": 1,
          "uniqueItems": true,
          "items": {
            "type": "string",
            "minLength": 1
          }
        },
        "validator_binding": {
          "$ref": "#/$defs/validator_binding"
        },
        "rationale": {
          "type": "string",
          "minLength": 1
        }
      }
    },
    "resource": {
      "type": "object",
      "additionalProperties": false,
      "required": [
        "path",
        "role"
      ],
      "properties": {
        "path": {
          "type": "string",
          "pattern": "^(?!/)(?!.*(?:^|/)\\.\\.(?:/|$))[A-Za-z0-9._/-]+$"
        },
        "role": {
          "type": "string",
          "pattern": "^[A-Z][A-Z0-9_]{0,63}$"
        },
        "sha256": {
          "type": "string",
          "pattern": "^[0-9a-f]{64}$"
        }
      }
    }
  }
}
