{"schema_version":"0.1.0","profile_id":"misco.publication","profile_type":"publication","profile_version":"1.1.0","description":"Production MISCO Publication profile. It delivers the Human-approved Layer A Publication rules plus detached source text; concrete formal values remain explicit external inputs and are never inferred.","core_compatibility":{"research_contract":">=0.1.0 <0.2.0","invariant_contract":">=0.1.0 <0.2.0"},"requires":[{"profile_id":"misco.writer","profile_type":"narrative","version":">=1.1.0 <2.0.0"}],"resources":[{"path":"resources/publication-clean-rules.json","role":"PUBLICATION_RULES","sha256":"6fa73e10a81de1d5b123c6cc76bab3bc936cb03c2b3ad2d6946dae80bb8ffdf4"},{"path":"resources/publication-clean-source-documents.json","role":"PUBLICATION_SOURCE_DOCUMENTS","sha256":"2d28e91cb46ff52b9a9a832bc7d6f84005917a2bb011b9b5954c278af3b78aee"}]}
