{"schema_version":"0.1.0","profile_id":"misco.publication","profile_type":"publication","profile_version":"1.3.0","description":"Production MISCO Publication profile. It delivers the Human-approved Layer A Publication rules, detached source text, the corrected SHA-256-pinned formal-spec application authority supplied on 2026-09-30, and the approved full-URL reader-facing policy.","core_compatibility":{"research_contract":">=0.1.0 <0.2.0","invariant_contract":">=0.1.0 <0.2.0"},"requires":[{"profile_id":"misco.writer","profile_type":"narrative","version":">=1.1.0 <2.0.0"}],"resources":[{"path":"resources/publication-clean-rules.json","role":"PUBLICATION_RULES","sha256":"6fa73e10a81de1d5b123c6cc76bab3bc936cb03c2b3ad2d6946dae80bb8ffdf4"},{"path":"resources/publication-clean-source-documents.json","role":"PUBLICATION_SOURCE_DOCUMENTS","sha256":"2d28e91cb46ff52b9a9a832bc7d6f84005917a2bb011b9b5954c278af3b78aee"},{"path":"resources/publication-formal-spec.json","role":"PUBLICATION_FORMAL_SPEC","sha256":"16a35cde2359db305eda9e6b2a98a494ca4e42ec85af274ddb68dac713085285"},{"path":"resources/publication-url-display.json","role":"PUBLICATION_URL_DISPLAY","sha256":"06a5f9e99e6a8cb7cfff98f63e8d17ea80f84a42e16051760abb102430cc95ca"}]}
