{"schema_version":"0.1.0","profile_id":"misco.publication","profile_type":"publication","profile_version":"1.4.0","description":"MISCO formal report conformance with explicit project metadata, exact output QA and original-clause coverage; activation uses the existing profile generation boundary.","core_compatibility":{"research_contract":">=0.1.0 <0.2.0","invariant_contract":">=0.1.0 <0.2.0"},"requires":[{"profile_id":"misco.writer","profile_type":"narrative","version":">=1.1.0 <2.0.0"}],"resources":[{"path":"resources/publication-clean-rules.json","role":"PUBLICATION_RULES","sha256":"6fa73e10a81de1d5b123c6cc76bab3bc936cb03c2b3ad2d6946dae80bb8ffdf4"},{"path":"resources/publication-clean-source-documents.json","role":"PUBLICATION_SOURCE_DOCUMENTS","sha256":"2d28e91cb46ff52b9a9a832bc7d6f84005917a2bb011b9b5954c278af3b78aee"},{"path":"resources/publication-formal-spec.json","role":"PUBLICATION_FORMAL_SPEC","sha256":"23543603af004a3d1977e09b47b4a545dfe5102f8ac481796b825ec4e32870ca"},{"path":"resources/publication-url-display.json","role":"PUBLICATION_URL_DISPLAY","sha256":"06a5f9e99e6a8cb7cfff98f63e8d17ea80f84a42e16051760abb102430cc95ca"},{"path":"resources/publication-coverage.json","role":"PUBLICATION_COVERAGE","sha256":"d05e565ce87299c7b215550742df2564374386282039504fe878ab6a9f4d3f6d"}]}
